-- Cursor coverage for built-in columnar tables.
CREATE SCHEMA columnar_cursor;
SET search_path TO columnar_cursor, public;
SET columnar.compression TO 'none';
CREATE TABLE cursor_test(a int, b int) USING columnar;
INSERT INTO cursor_test
SELECT i, j
FROM generate_series(0, 30) i,
     generate_series(100, 110) j;
BEGIN;
DECLARE c_equal SCROLL CURSOR FOR
SELECT * FROM cursor_test WHERE a = 5 ORDER BY b;
FETCH 3 FROM c_equal;
 a |  b  
---+-----
 5 | 100
 5 | 101
 5 | 102
(3 rows)

FETCH PRIOR FROM c_equal;
 a |  b  
---+-----
 5 | 101
(1 row)

FETCH NEXT FROM c_equal;
 a |  b  
---+-----
 5 | 102
(1 row)

FETCH NEXT FROM c_equal;
 a |  b  
---+-----
 5 | 103
(1 row)

FETCH RELATIVE -2 FROM c_equal;
 a |  b  
---+-----
 5 | 101
(1 row)

FETCH LAST FROM c_equal;
 a |  b  
---+-----
 5 | 110
(1 row)

FETCH RELATIVE -4 FROM c_equal;
 a |  b  
---+-----
 5 | 106
(1 row)

MOVE c_equal;
FETCH c_equal;
 a |  b  
---+-----
 5 | 108
(1 row)

MOVE LAST FROM c_equal;
FETCH c_equal;
 a | b 
---+---
(0 rows)

MOVE RELATIVE -3 FROM c_equal;
FETCH c_equal;
 a |  b  
---+-----
 5 | 109
(1 row)

UPDATE cursor_test SET a = 8000 WHERE CURRENT OF c_equal;
ERROR:  WHERE CURRENT OF is not supported for this table type
ROLLBACK;
BEGIN;
DECLARE c_range SCROLL CURSOR FOR
SELECT * FROM cursor_test WHERE a > 28 ORDER BY a, b;
FETCH 3 FROM c_range;
 a  |  b  
----+-----
 29 | 100
 29 | 101
 29 | 102
(3 rows)

FETCH PRIOR FROM c_range;
 a  |  b  
----+-----
 29 | 101
(1 row)

FETCH NEXT FROM c_range;
 a  |  b  
----+-----
 29 | 102
(1 row)

FETCH NEXT FROM c_range;
 a  |  b  
----+-----
 29 | 103
(1 row)

FETCH RELATIVE -2 FROM c_range;
 a  |  b  
----+-----
 29 | 101
(1 row)

FETCH LAST FROM c_range;
 a  |  b  
----+-----
 30 | 110
(1 row)

FETCH RELATIVE -4 FROM c_range;
 a  |  b  
----+-----
 30 | 106
(1 row)

MOVE c_range;
FETCH c_range;
 a  |  b  
----+-----
 30 | 108
(1 row)

MOVE LAST FROM c_range;
FETCH c_range;
 a | b 
---+---
(0 rows)

MOVE RELATIVE -3 FROM c_range;
FETCH c_range;
 a  |  b  
----+-----
 30 | 109
(1 row)

UPDATE cursor_test SET a = 8000 WHERE CURRENT OF c_range;
ERROR:  WHERE CURRENT OF is not supported for this table type
ROLLBACK;
SELECT count(*) AS unchanged_rows
FROM cursor_test
WHERE a = 8000;
 unchanged_rows 
----------------
              0
(1 row)

DROP TABLE cursor_test;
RESET search_path;
DROP SCHEMA columnar_cursor;
