-- Update/delete coverage for built-in columnar tables.
CREATE SCHEMA columnar_update_delete;
SET search_path TO columnar_update_delete, public;
SET columnar.compression TO 'none';
CREATE TABLE columnar_update(a int, b int) USING columnar;
INSERT INTO columnar_update VALUES (1, 10), (2, 20), (3, 30);
UPDATE columnar_update SET b = b + 1 WHERE a = 2;
DELETE FROM columnar_update WHERE a = 2;
INSERT INTO columnar_update VALUES
    (3, 5),
    (4, 5),
    (5, 5)
ON CONFLICT DO NOTHING;
INSERT INTO columnar_update VALUES
    (3, 5),
    (4, 5),
    (5, 5)
ON CONFLICT (a) DO NOTHING;
ERROR:  there is no unique or exclusion constraint matching the ON CONFLICT specification
SELECT * FROM columnar_update WHERE a = 2 FOR SHARE;
 a | b 
---+---
(0 rows)

SELECT * FROM columnar_update WHERE a = 2 FOR UPDATE;
 a | b 
---+---
(0 rows)

SELECT * FROM columnar_update WHERE ctid = '(0,2)';
 a | b  
---+----
 1 | 10
(1 row)

SELECT * FROM columnar_update ORDER BY a, b;
 a | b  
---+----
 1 | 10
 3 |  5
 3 | 30
 4 |  5
 5 |  5
(5 rows)

CREATE TABLE update_parent(
    ts timestamptz,
    a int,
    b numeric,
    payload text
) PARTITION BY RANGE (ts);
CREATE TABLE update_p0 PARTITION OF update_parent
FOR VALUES FROM ('2024-01-01') TO ('2024-02-01')
USING columnar;
CREATE TABLE update_p1 PARTITION OF update_parent
FOR VALUES FROM ('2024-02-01') TO ('2024-03-01')
USING columnar;
CREATE TABLE update_p2 PARTITION OF update_parent
FOR VALUES FROM ('2024-03-01') TO ('2024-04-01');
INSERT INTO update_parent VALUES
    ('2024-01-15', 10, 100, 'one'),
    ('2024-02-15', 20, 200, 'two'),
    ('2024-03-15', 30, 300, 'three'),
    ('2024-03-21', 31, 301, 'three-one'),
    ('2024-03-22', 32, 302, 'three-two'),
    ('2024-03-23', 33, 303, 'three-three');
SELECT tableoid::regclass AS partition_name, ts::date, a, b, payload
FROM update_parent
ORDER BY ts;
 partition_name |     ts     | a  |  b  |   payload   
----------------+------------+----+-----+-------------
 update_p0      | 01-15-2024 | 10 | 100 | one
 update_p1      | 02-15-2024 | 20 | 200 | two
 update_p2      | 03-15-2024 | 30 | 300 | three
 update_p2      | 03-21-2024 | 31 | 301 | three-one
 update_p2      | 03-22-2024 | 32 | 302 | three-two
 update_p2      | 03-23-2024 | 33 | 303 | three-three
(6 rows)

UPDATE update_p2 SET a = a + 1 WHERE ts = '2024-03-15';
DELETE FROM update_p2 WHERE ts = '2024-03-21';
UPDATE update_p1 SET a = a + 1 WHERE ts = '2024-02-15';
DELETE FROM update_p1 WHERE ts = '2024-02-15';
UPDATE update_parent SET a = a + 1 WHERE ts = '2024-03-15';
DELETE FROM update_parent WHERE ts = '2024-03-22';
UPDATE update_parent SET a = a + 1 WHERE ts > '2024-02-15';
DELETE FROM update_parent WHERE ts > '2024-02-15';
SELECT tableoid::regclass AS partition_name, ts::date, a, b, payload
FROM update_parent
ORDER BY ts;
 partition_name |     ts     | a  |  b  | payload 
----------------+------------+----+-----+---------
 update_p0      | 01-15-2024 | 10 | 100 | one
(1 row)

ALTER TABLE update_parent DETACH PARTITION update_p0;
DROP TABLE update_p0;
DROP TABLE update_parent;
CREATE TABLE transaction_update(a int, b int) USING columnar;
INSERT INTO transaction_update
SELECT g, g * 10
FROM generate_series(1, 20000) g;
SELECT count(*) FROM transaction_update;
 count 
-------
 20000
(1 row)

BEGIN;
DELETE FROM transaction_update WHERE a % 2 = 0;
SELECT count(*) FROM transaction_update;
 count 
-------
 10000
(1 row)

UPDATE transaction_update SET b = -1 WHERE a % 3 = 0;
SELECT count(*) FROM transaction_update WHERE b = -1;
 count 
-------
  3333
(1 row)

COMMIT;
SELECT count(*) FROM transaction_update;
 count 
-------
 10000
(1 row)

SELECT count(*) FROM transaction_update WHERE b = -1;
 count 
-------
  3333
(1 row)

SELECT sum(a), sum(b) FROM transaction_update;
    sum    |    sum    
-----------+-----------
 100000000 | 666729997
(1 row)

RESET search_path;
DROP SCHEMA columnar_update_delete CASCADE;
NOTICE:  drop cascades to 2 other objects
DETAIL:  drop cascades to table columnar_update_delete.columnar_update
drop cascades to table columnar_update_delete.transaction_update
